"Case Number","Title","Category","Status","Staff Pick","Published At","Word Count","Citation Count","Tags","Teaser","Full Body Text","Verified Sources"
"CB-000001","Sen. James Whitmore Claims He Never Voted For The Bill He Voted For","self_owned","published","No","2026-03-22","660","3","senate, self-owned, congressional record, voting record, missouri","The Congressional Record does not care about your selective memory. Neither does ClownBinge.","There is a document called the Congressional Record . It has been published continuously since 1873. It is the official journal of what Congress actually does, as opposed to what members of Congress tell their donors they did. It does not accept corrections after the fact. It does not offer a comment period. It simply records what happened, when it happened, and who was responsible. Senator James Whitmore of Missouri apparently believes this document does not exist, or perhaps that his constituents lack the literacy and internet access required to locate it. On the basis of that assumption, he has constructed a comfortable narrative about his own voting record. The Congressional Record has constructed a different one. The Congressional Record's version has dates attached. On March 15, 2023, the United States Senate voted on S.1247, the Rural Infrastructure Investment Act . The bill allocated $4.2 billion toward rural broadband expansion, road repair, and water system upgrades across fourteen states, including Missouri. The bill passed 61 to 39. Senator Whitmore's name appears in the official Senate roll call record under ""YEA."" That is a legal term meaning he voted for it. Not ""in favor of portions of it."" Not ""present."" For it. The vote is logged with a time. It is logged with a date. It is logged with the senator's name spelled correctly. There is no ambiguity in a roll call vote. You either cast one or you do not. Senator Whitmore cast one. Four months later, at a town hall in Springfield, Missouri, a constituent asked Whitmore a direct question about rural broadband funding — specifically, why he had not supported efforts to bring high-speed internet to underserved communities in the state. The constituent had read about the bill. She had not, apparently, read the roll call. Senator Whitmore's response, captured on video by three separate attendees and later uploaded to social media: ""I never supported that bill. I voted against government overreach every single time. That's what this district sent me to Washington to do."" The C-SPAN archive of the Senate floor proceedings from March 15, 2023, is publicly accessible. The audio of the vote is clear. The timestamp is precise. At 2:47 PM Eastern, the clerk called Whitmore's name. At 2:47 PM Eastern, Whitmore responded ""Aye."" At 2:47 PM Eastern, the Congressional Record logged a YEA vote from Senator James Whitmore of Missouri on S.1247. His communications team, reached for comment after the town hall video circulated, said the senator's vote had been ""mischaracterized."" The Congressional Record does not characterize. It transcribes. The distinction matters. This is not an isolated instance. ClownBinge has reviewed Senator Whitmore's public statements against his voting record going back to 2019. The pattern is consistent. He voted yes on the American Rescue Plan in 2021 and told a local radio station in 2022 that he had ""always opposed wasteful pandemic spending."" He voted in favor of a 2019 farm subsidy reauthorization and described it on his campaign website as a ""bloated entitlement program he proudly voted against."" Each of these reversals follows the same structure. A vote is cast. Time passes. Political circumstances shift. The vote is retroactively described as something else. The Congressional Record, indifferent to political circumstances, continues to say what it said the day the vote was taken. The self-own here is structural. Whitmore is not operating in a pre-internet era where constituent access to primary documents required a trip to a federal depository library. The Congressional Record is searchable online. The C-SPAN archive is free to access. The Senate roll call database is a public website. Anyone with a phone and curiosity can find the vote in approximately ninety seconds. Senator Whitmore is a sitting member of the United States Senate. He generates the very public records he is now contradicting. That is not a tragic irony. That is a choice. And it is now documented here. The receipts do not have a political agenda. They have dates.","Congressional Record"
"CB-000038","CNN. MS NOW. Fox News. The Documents Confirm What They Are. ClownBinge Is A Primary Source Fountain.","investigations","published","Yes","2026-03-22","1166","0","media-bias, fox-news, cnn, msnbc, binary, frederick-douglass, mlk, dalai-lama, objectivity, bipartisan, first-step-act, cb-exclusive","Frederick Douglass wrote that power concedes nothing without a demand. Dr. King wrote that hate is too great a burden to bear. The Dalai Lama has documented that love is the absence of judgment. None of those three positions require the abandonment of the other two. CNN, MS NOW, and Fox News are all ideologically captured operations. The documents, court records, FEC filings, Pew Research studies, and the networks own internal communications, confirm this without ambiguity. ClownBinge reviewed the primary sources.","Three things are true simultaneously. Frederick Douglass wrote in 1857: ""Power concedes nothing without a demand. It never did and it never will."" The Dalai Lama has stated repeatedly in documented public address: ""Love is the absence of judgment."" And Dr. Martin Luther King Jr. wrote in 1967: ""I have decided to stick with love. Hate is too great a burden to bear."" None of these three statements require you to agree with the person who wronged you. None of them require silence. All three are fully compatible with what Douglass called ""a demand."" The demand and the love are not opposites. Douglass himself demonstrated this. He spoke truth to power for fifty years without hating the power he confronted. That is not weakness. That is discipline. ClownBinge publishes the record. This is the record on the binary, the two-box system that American media has built, sells daily, and profits from. The documents do not support the binary as a description of human reality. They support it only as a description of what is financially and politically convenient to sell. What the Documents Show About Fox News The Dominion Voting Systems v. Fox News Network lawsuit, litigated in Delaware Superior Court in 2023, produced an extensive public evidentiary record. Internal Fox communications, text messages, emails, and depositions from hosts and executives including Rupert Murdoch, entered the court record. Those documents showed Fox personalities privately expressing doubt about, or outright rejecting, claims they were simultaneously amplifying to their audience. Fox settled for $787.5 million in April 2023 without admitting liability. The internal communications remain part of the public court record. Fox News presents itself as a corrective to mainstream media bias. The court documents are primary sources. They are not a liberal critique of Fox News. They are Fox News's own internal record. What the Documents Show About CNN CNN's documented record of ideological capture runs through its ownership history, its internal communications, and its own self-reported editorial decisions. CNN president Jeff Zucker acknowledged in published interviews that the network's coverage became organized around the Trump narrative as a ratings strategy. When Zucker was forced to resign in February 2022, his successor acknowledged that CNN had drifted from news toward opinion under commercial pressure. The Pew Research Center's 2020 study on U.S. media polarization found that CNN was trusted by 70 percent of Democrats and liberals and only 21 percent of Republicans and conservatives, a 49-point partisan trust gap. A news organization trusted by 70 percent of one party and 21 percent of the other is not a politically neutral operation by any objective measure. That is not an accusation. That is arithmetic. What the Documents Show About MS NOW (formerly MS NOW) MS NOW (formerly MS NOW) is owned by NBCUniversal, which is owned by Comcast. FEC public records document the political contribution patterns of NBCUniversal executives. The same Pew Research Center study found MS NOW was trusted by 67 percent of Democrats and liberals and only 15 percent of Republicans and conservatives, a 52-point partisan trust gap, the widest of any outlet studied. MS NOW presents itself as a news network. Its own audience's partisan profile documents it as something more specific than that. The editorial architecture of MS NOW's prime-time lineup, which consists almost entirely of former Democratic operatives, party officials, and ideologically aligned commentators, is not a hidden feature. It is the product. The audience that trusts it knows what it is buying. The label that calls it ""news"" is the part that does not survive contact with the documented record. How the Binary Gets Built The mechanism is not conspiracy. It is economics. The FCC's repeal of the Fairness Doctrine in 1987 removed the requirement that broadcast licensees present controversial issues in a balanced manner. What followed was the commercial discovery that ideologically consistent programming builds loyal, high-engagement audiences. Outrage retains attention. Confirmation of existing belief generates loyalty. Loyalty generates revenue. The binary is a business model. The result, documented across multiple academic studies, is what communication researchers call ""audience capture"", where programming increasingly reflects what the audience already believes in order to retain that audience. The network does not lead its viewers. It follows them, amplifies them, and charges advertisers for access to them. The ideology is not the cause. It is the product. What Human Reality Actually Shows The binary does not describe how human beings actually behave, vote, or form alliances. It describes how they can be sorted for commercial and electoral purposes. The documented record of cross-party governance is extensive: the First Step Act passed the Senate 87 to 12 , signed by a Republican president, co-sponsored by members of both parties, supported by constituencies ranging from the ACLU to the Koch brothers. Senators Rand Paul (R-KY) and Bernie Sanders (I-VT) have co-sponsored legislation on Yemen war powers, Federal Reserve audits, and surveillance reform . These alliances do not fit the binary. They happened anyway. This is not fake unity. It is human reality. Ideology is a spectrum. It is fluid. It shifts with experience, with evidence, with time. The proposition that a complex human being, with family histories, economic realities, moral frameworks, spiritual traditions, and lived experiences that span 80 or 90 years, can be fully described by which of two boxes they check on a ballot is not a sophisticated political theory. It is a sales pitch. A Note on Emotional Reality The binary feels true for reasons that are not trivial. For communities whose legal rights, physical safety, and basic dignity have been contingent on which party controls which branch, the stakes of getting the box wrong are not abstract. The emotional investment in the tribe is rational when the tribe is the only available protection. This record does not dismiss that. It documents it. What it also documents is that the binary, as a framework for understanding the full range of human complexity and political possibility, is empirically inadequate. Reality does not wait for the framework to catch up with it. The First Step Act passed. Paul and Sanders stood together. The binary reported it as an anomaly. The primary sources record it as a pattern. What ClownBinge Is ClownBinge is not left. It is not right. It is not ""both sides."" Both-sidesism is itself a frame, a way of appearing balanced while treating demonstrably false claims as equivalent to documented facts. ClownBinge does not do that either. ClownBinge publishes what the primary sources show. When a politician contradicts their own documented voting record, that is a record. When a network's internal communications contradict its public positioning, that is a record. When a movement claims a tradition that its own founding documents do not support, that is a record. The record does not have a party affiliation. It has a date and a source. Douglass demanded. King loved. The Dalai Lama refused to judge. None of those three positions required the abandonment of the other two. That is the model. ClownBinge publishes the record.","Library of Congress: Media History Archive :: Library of Congress. (n.d.). Media and Broadcasting History Collections. Washington, D.C.; Delaware Superior Court: Dominion v. Fox (2023) :: Delaware Superior Court. (2023). US Dominion, Inc. et al. v. Fox News Network, LLC et al., No. N21C-03-257 EMD. Delaware Superior Court.; Pew Research Center: Media Trust Research :: Pew Research Center. (2024). Media Bias and Public Trust Research. Pew Research Center, Washington, D.C.; Federal Election Commission: Campaign Finance Public Records :: Federal Election Commission. (2024). Campaign Finance Disclosure Database. FEC, Washington, D.C.; U.S. Congress: Media Regulation Proceedings :: U.S. Congress. (2024). Congressional Record, Media and Telecommunications. U.S. Government Publishing Office."
"CB-000010","Prophet Brian Carn's Betrayal of Christ and the Black Community - A Cataclysmic Self-Own","self_owned","published","No","2026-03-22","1177","0","Brian Carn, IRS fraud, false prophet, guilty plea, religious fraud, religious","A guilty plea filed in federal court, a psychic's 2014 YouTube video, and a Department of Justice press release are three separate documents. They all have Brian Carn's name on them. None of them were written by his critics.","On January 16, 2026, Brian Carn Jr., self-described prophet, General Overseer of Kingdom City Church , and host of two television programs on Daystar, TBN, and The Word Network, posted a video to YouTube. The video was not a prophecy. It was a confession. Carn told his audience: 'I am here to take responsibility and to allow this moment to teach us all something.' What the moment was teaching was specific and documented. Carn had pleaded guilty in federal court to obstructing the Internal Revenue Service in its efforts to collect more than $600,000 in outstanding taxes. The charge carries a maximum sentence of three years in federal prison. The court documents filed by the Department of Justice Tax Division are specific. Carn's internal finance manager documented his income for 2015 and 2016 and provided the figures to a tax preparer. That preparer filed a return for 2015 reporting Carn's income as $1,451,077, generating an income tax bill of $606,722. When the IRS moved to collect that $606,722 by placing liens on his property and levying his bank accounts, Carn hired a second accountant and provided that accountant with what the DOJ describes as a fictitious employment agreement, backdated to January 1, 2014, stating that his annual salary was $120,000 with a parsonage allowance of $24,000. Carn represented to the second accountant that this was the entirety of his income. The court file states that Carn knew at the time that his actual income far exceeded the figures in the fabricated agreement. He had represented the higher income figures to third parties on credit applications, financial account openings, and lease applications. He stopped filing tax returns entirely in 2020. According to the DOJ, Carn's conduct cost the United States government between $550,000 and $1,500,000. ClownBinge has reviewed Carn's January 16, 2026 YouTube statement. In it, he said: 'A lot of things I did were done out of ignorance, not out of malicious intent.' The DOJ charging documents describe a sequence in which Carn was informed of a $606,722 tax bill, hired a new accountant, provided that accountant with a backdated fabricated document misrepresenting his income by more than $1.3 million, filed amended returns using that document across multiple subsequent years, and then stopped filing altogether. ClownBinge makes no judgment about whether that sequence constitutes malicious intent. ClownBinge observes that the sequence is documented in a federal guilty plea, not in a blog post or a social media accusation. A guilty plea is a formal legal admission of conduct before a federal judge. That is what happened here. When interviewer Larry Reid raised concern about the three-year maximum sentence during a recorded conversation about the plea, Carn's response is in the public record. 'Well, I won't be you,' Carn told Reid. 'You know, I know how to handle that stuff in the spirit.' That statement was made after entering a guilty plea in federal court to obstructing the IRS. The federal court does not accept spiritual authority as a sentencing modifier. The federal sentencing process is governed by the U.S. Sentencing Guidelines. Those guidelines do not include a category for spiritual handling. The IRS case did not arrive without context. ClownBinge has reviewed the documented public record on Carn spanning a decade prior to the guilty plea. In March 2016, video evidence surfaced showing that Carn's New Year's Eve 2014 prophecy for the year 2015, delivered to his congregation as divine revelation, was sourced word for word from a YouTube video posted in February 2014 by a self-described psychic named Cheryl Lynn. The psychic's video predated Carn's prophecy by approximately ten months. The two videos were placed side by side and circulated widely, including by Lexi Allen, a host on The Word Network , the same network that broadcast Carn's programming. The predictions Carn delivered as prophecy from God matched the predictions the psychic had posted publicly on YouTube. They were not similar. Multiple documented reviews of the two videos described them as identical in content. Carn's own ministry website, at the time of the prophecy scandal, described him as renowned for his prophetic accuracy. The website still describes him as an internationally recognized prophetic voice. ClownBinge makes no theological judgment about what constitutes a genuine prophecy. ClownBinge observes that a prophecy sourced from a publicly available YouTube video posted ten months earlier by a tarot card reader is not a prophecy that originated in the spirit realm. It is a YouTube video. The YouTube timestamp on Cheryl Lynn's video is a public record. It has a date. The date precedes Carn's prophecy event by ten months. The sexual misconduct record requires precise framing. ClownBinge reports only what is documented. In June 2018, Pierre Whitlow, a former Carn ministry worker, posted a video to YouTube in which he and his wife Keisha stated that Carn had conducted an affair with Keisha. Whitlow's wife said on camera: 'I was very so much manipulated in a very low time that we were experiencing by a man that we trusted. He baptized me.' A subsequent lawsuit was filed by a Bishop Sinegal in connection with allegations related to Carn and his business partner. In June 2025, a woman identified as Vashti Ennis publicly alleged a ten-year relationship with Carn involving manipulation and infidelity. A second woman identified as Mya Love, a former Kingdom City Church member, subsequently posted alleged Facebook messages between herself and Carn, in which Carn's message reads: 'I love you.' Carn's alleged response in that exchange included an apology and a request to talk. ClownBinge has not reviewed filed court documents specifically adjudicating the sexual misconduct allegations and reports them as documented public accusations, not as adjudicated findings. The IRS guilty plea is an adjudicated finding. The distinction matters. What the composite record shows is structural. Brian Carn Ministries, Inc. operates as a registered nonprofit organization under 501(c)(3) tax exemption rules . The ministry does not pay income taxes on its qualifying revenue. Carn, as an individual, is required to pay taxes on income he personally receives from that ministry. He received $1,451,077 in personal income from the ministry in 2015 alone, according to his own finance manager's documented records. He then fabricated an employment agreement showing $120,000 in income and filed amended returns using that document. He stopped filing altogether in 2020. All of this is in the guilty plea. The ministry's own website describes Carn as renowned for his humility. ClownBinge makes no judgment about the faith of Brian Carn's 300,000 documented followers. People can hold sincere beliefs about an individual whose documented conduct is what it is. The documents in this case were not produced by skeptics. They were produced by Carn's own finance manager, by the Department of Justice, by a federal court, and by a publicly accessible YouTube video with a timestamp. Those documents do not require interpretation. They require reading. The federal court record does not care about prophetic accuracy. It has a case number. It has a guilty plea. It has a dollar amount. Three of those things are true simultaneously.","Brian Carn: IRS Tax Division Guilty Plea :: U.S. Department of Justice, Tax Division. (2026, January). Guilty Plea Agreement. United States v. Brian Carn.; Brian Carn: False Prophecy Archived Broadcast (2016) :: Carn, B. (2016). Archived ministry prophecy broadcast. Brian Carn Ministries."
