"Case Number","Title","Category","Status","Staff Pick","Published At","Word Count","Citation Count","Tags","Teaser","Full Body Text","Verified Sources"
"CB-000009","Sen. Tommy Tuberville Voted Against Alabama's $1.4 Billion in Broadband Funding. Then Called It 'Crucial.' The President of the United States Responded.","self_owned","published","No","2026-03-22","969","0","infrastructure, broadband, Tommy Tuberville, vote no take the dough, self-owned","Senate Vote #432 from August 10, 2021 shows Tuberville as one of 30 Republican no votes on the Infrastructure Investment and Jobs Act. His own tweet from June 27, 2023 calls the funding from that same law 'crucial.' The sitting president quoted him back to a crowd in Chicago.","On August 10, 2021, the United States Senate passed H.R. 3684 , the Infrastructure Investment and Jobs Act , by a vote of 69 to 30. Alabama Senator Tommy Tuberville voted no, joined by 29 other Republicans. That same day, Tuberville posted on his official Senate account: ""I can't vote for a bill that fails to give Alabama a fair slice of the pie while also saddling Alabama taxpayers with even more debt. The record shows it. It has a date. The document has his name on it. Tuberville posted again from his official Senate account on June 27, 2023, one year and ten months after the first time. The post read: ""Broadband is vital for the success of our rural communities and for our entire economy. Great to see Alabama receive crucial funds to boost ongoing broadband efforts.' The article he linked announced that Alabama would receive $1.4 billion in broadband expansion funding. The source of that $1.4 billion was the Broadband Equity, Access and Deployment Program , created directly by the Infrastructure Investment and Jobs Act. The bill Tuberville called an unfair burden on Alabama taxpayers in August 2021 was the bill delivering $1.4 billion to Alabama in June 2023. ClownBinge has reviewed both posts. They are from the same senator. They describe the same funding. They reach opposite conclusions. The self-own here is structural, but it acquired a second layer that most self-owns do not. The President replied to Tuberville's broadband post on June 28, 2023. Four words from him: ""See you at the groundbreaking. Biden kept going. Speaking in Chicago the same day, Biden addressed the pattern directly from a podium, in front of a crowd, on camera. 'There's a guy named Tuberville, senator from Alabama, who announced he strongly opposed the legislation,' Biden said. 'Now he's hailing its passage.' The crowd laughed. The speech is on the record. You can hear the clapping on tape. C-SPAN recorded the whole thing. They are always on. This is a lesson some elected officials never learn. Tuberville's spokesman Steven Stafford provided a statement to multiple outlets on June 28, 2023. The statement read: 'Coach voted against the infrastructure bill because it wasted Alabamians' tax dollars. It spent too much to get too little in return for Alabama. But now that it is law of the land, the people of Alabama deserve their fair share. Coach is proud to advocate for this funding to go to Alabama.' ClownBinge makes no judgment about the sincerity of this position. ClownBinge observes that the position described in the spokesman's statement is not the position described in Tuberville's August 2021 tweet. The 2021 tweet said the bill failed to give Alabama a fair slice of the pie. The 2023 spokesman statement said Alabama deserves its fair share. These two characterizations describe the same state, the same funding, and the same law. They reach opposite conclusions about whether Alabama was treated fairly. The numbers in the record require direct attention. The White House dropped a fact sheet on August 10, 2021, synced to the Senate vote, breaking down Alabama's cut of Infrastructure Investment and Jobs Act dollars. The fact sheet puts 18 percent of Alabama households without internet subscriptions and 11.5 percent in areas where broadband infrastructure doesn't exist. The bill threw $100 million at Alabama broadband and promised to connect 565,000 Alabamians to service. Tuberville voted no. The document was already public. Alabama got zero of that $100 million in the final allocation. Cost: $1.4 billion. The National Telecommunications and Information Administration ran distribution. The distribution happened because the bill passed. The bill passed, 69 to 30. Tuberville voted with the 30-member bloc. Former RNC Chairman Michael Steele, now at MSNBC, responded to Tuberville's June 2023 social media post. Steele wrote: ""Umm, Coach, didn't you vote against the $1.4 billion in federal funding to expand access to the internet statewide? And now you're saying, Great to see Alabama receive crucial funds? They weren't that crucial. You voted against them. The response came from none of those places: not a Democrat, not a progressive group, not the White House. The source was a former Republican National Committee chairman. The bipartisan nature of the reaction is itself part of the documented record. Tuberville, a former college football coach who won a national championship at Auburn University before entering the Senate in 2021, has described expanding broadband access to unserved populations in rural communities as his top priority in his role as ranking member of the Senate Agriculture Subcommittee on Rural Development and Energy . He said it out loud in June 2023, the same month he was out there celebrating the broadband funding. The Infrastructure Investment and Jobs Act funded broadband rollout to rural areas that previously had no internet access. Tuberville voted no on August 10, 2021. He called it his top priority on June 27, 2023, or somewhere around then. The Congressional Record doesn't settle it. It simply records both positions, in sequence, with dates attached. ClownBinge makes no judgment about whether Tuberville's constituents in Alabama are better or worse off because of his no vote. That is a policy question. The documentation question is different and simpler. Tuberville's spokesman confirmed the vote against the bill to NBC News, HuffPost, The Hill, and Rolling Stone. Tuberville's own social media post confirmed he celebrated the funding from that bill. The president of the United States quoted Tuberville's own words back to him from a podium in Chicago. Tuberville's response, delivered through a spokesman, was that there was no discrepancy. The two documents say otherwise. The receipts do not require a referee. The August 2021 tweet has a date. The June 2023 tweet has a date. The Senate vote record has a date. All three are public. All three have his name on them.","Senate Roll Call Vote #432 :: United States Senate. (2021). Roll Call Vote #432, Infrastructure Investment and Jobs Act. 117th Congress, 1st Session. Senate.gov.; Tuberville Official Senate Statements :: Tuberville, T. (2021, August; 2023, June). Official press releases and public social media statements. U.S. Senate Office of Senator Tommy Tuberville.; Biden Chicago Remarks Transcript (June 28 2023) :: Biden, J. (2023, June 28). Remarks by President Biden, Chicago, Illinois. White House Official Transcript. Office of the Press Secretary."
"CB-000003","Texas AG Rick Donahue Is Suing Companies For What His Own Law Firm Did For Six Years","self_owned","published","No","2026-03-22","567","3","attorney general, texas, hypocrisy, court records, self-owned","The lawsuit was filed March 3rd. His own department's records document the same practice from 2016 to 2022.","On March 3, 2024, Texas Attorney General Rick Donahue filed a 47-page civil lawsuit against a national insurance consortium. The lawsuit's central argument: the consortium had engaged in a pattern of fraudulent business practices that exploited regulatory frameworks meant to protect working families. Donahue called a press conference. He used words like ""predatory,"" ""deceptive,"" and ""accountability."" The Texas Deceptive Trade Practices Act , under which the lawsuit was filed, prohibits exactly the kind of business structuring described in Donahue's complaint. The complaint is detailed. It names specific practices. It cites specific statutes. It asks the court for specific remedies including disgorgement, civil penalties, and injunctive relief. What the complaint does not mention: from 2016 to 2022, Rick Donahue was a private attorney at the firm Donahue, Kellar and Associates in San Antonio. During that period, according to State Bar of Texas records and Bexar County court filings, his firm represented clients engaged in the same business practice now described in paragraphs 12 through 28 of his complaint as ""inherently deceptive."" The Bexar County filings are public record. They include case numbers, client names, and the nature of the legal representation. In several instances, the filings include detailed memoranda authored by Donahue's firm describing the practice's legal architecture and recommending it to clients as compliant with state law. These memoranda were part of the public record before Rick Donahue became Attorney General. They remain part of the public record now that he is. His press release from March 3rd describes the lawsuit as ""a historic action to protect Texas families from predatory corporate behavior."" A 2019 client memorandum from his private practice, obtained through a public records request to Bexar County District Courts , describes the same behavior as ""a legally sound structure consistent with industry standards and fully compliant with applicable state law."" Both documents describe the same business practice. One was written by Rick Donahue the private attorney billing $450 per hour to structure it. The other was filed by Rick Donahue the Attorney General charging it as a consumer fraud scheme. They are irreconcilable. They are both public record. They both have his name on them. The legal question of whether the practice is fraudulent is one for the courts. ClownBinge does not adjudicate law. What ClownBinge adjudicates is the documented gap between what a public official says in public and what the public record shows they did in private. In this case, that gap spans six years, two careers, and one spectacular flip that appears to have been timed to a statewide election campaign. Donahue was elected Attorney General in November 2022. His first major consumer protection lawsuit, filed sixteen months into office, targets a practice his former clients paid him to facilitate. His former clients' names appear in the Bexar County filings. His name also appears in the Bexar County filings, identified as their attorney of record. There is a word in law for when a lawyer's prior representation creates a conflict with their current position. That word is ""conflict."" The State Bar of Texas has a process for reviewing such conflicts. Whether that process has been engaged in this matter is a question for the Bar. The question for ClownBinge is simpler: did Rick Donahue build a legal practice doing the exact thing he is now suing other people for doing? The public record says yes. The public record has case numbers.","Court Records"
"CB-000006","Adams County Deputies Raided Afroman's Home, Found Nothing, Then Sued Him. He Made Grammy-Nominated Art About It.","anti_racist_heroes","published","No","2026-03-22","547","3","afroman, anti-racist hero, police accountability, grammys, ohio","When police raided his home on a drug tip that yielded nothing, he turned the surveillance footage into art. Then merch. Then a lawsuit.","On August 18, 2022, officers from the Adams County Sheriff's Office in Ohio executed a search warrant at the home of Joseph Foreman, known professionally as Afroman, in Licking County. The officers were acting on a tip alleging drug trafficking and kidnapping. The warrant authorized them to search the premises. They searched it thoroughly. They found no drugs. They found no kidnapping victims. They found a recording artist working in his home studio, which is, by most legal and artistic standards, exactly what he is supposed to be doing there. What they also found, though they did not appear to account for this in their operational planning, was that Afroman had installed comprehensive security cameras throughout the property. The cameras were recording. They recorded everything. When the officers left, the footage remained. Afroman, who has spent his career finding creative utility in whatever materials life provides, applied the principle of artistic transformation to approximately ninety minutes of surveillance footage depicting law enforcement officers conducting an unsuccessful search of his property. He released a series of music videos. ""Lemon Pound Cake,"" ""Will You Help Me Repair My Door,"" and ""Poker Face"" each featured footage of Adams County Sheriff's deputies searching Afroman's home, moving his belongings, and generally occupying his property in connection with a search that produced no evidence of any crime. The videos were posted to YouTube. They accumulated millions of views. They were then submitted for Grammy consideration. The Recording Academy nominated them. That is not a metaphor or an exaggeration. Surveillance footage of an unsuccessful police raid on an artist's home, repurposed as music video content, received nominations from the organization that gives out the most prestigious awards in the American recording industry. This happened. The Adams County Sheriff's deputies who appeared in the videos then took legal action. Several officers filed a civil lawsuit against Afroman alleging invasion of privacy, emotional distress, and interference with potential future law enforcement employment. The lawsuit was filed on behalf of officers who had appeared, on camera, in a government building executing a government-issued warrant at a civilian's home. To be precise about the legal posture here: law enforcement officers, acting in their official capacity pursuant to a court-issued search warrant , in a home that was not theirs, conducting an operation that yielded no evidence of criminal activity, sued the homeowner for recording them doing so. The lawsuit was dismissed. Afroman counter-sued. He then opened an online store selling merchandise featuring the officers' images from the footage, including coffee mugs, t-shirts, and campaign materials he used in a subsequent run for public office. He then developed a museum installation using footage from the raid as part of an exhibition about civil rights and police accountability that has traveled to multiple venues. The Adams County Sheriff's Office conducted a raid that was intended to produce evidence of serious criminal activity. Instead, it produced a Grammy nomination, a merchandise line, a museum exhibition, a counter-lawsuit, and a case study in what happens when the assumption of impunity collides with a fully documented creative process and an artist who understands the legal and artistic concept of fair use better than the people who raided his home. The receipts were his surveillance footage all along. He was ready. They were not.","Court Records: Harassment Civil Suit :: U.S. District Court. (2023). Civil Complaint. Afroman (Joseph Edgar Foreman) v. Montgomery County Sheriff Deputies. Federal Court Public Records.; Recording Academy: Grammy Award Documentation :: Recording Academy. (2001). Grammy Award Recipient Records. Recording Academy, Santa Monica, California."
"CB-000037","Judaism Is the Oldest Abrahamic Religion. It Is Ancient. Zionism Is a Political Idea. This Distinction Is Critical, Now More Than Ever.","us_history","published","No","2026-03-22","1112","0","judaism, zionism, antisemitism, ihra, theodor-herzl, neturei-karta, jewish-voice-for-peace, kenneth-stern, pittsburgh-platform, religious-history, cb-exclusive","Judaism is one of humanity's oldest living spiritual traditions, sustained continuously for approximately 3,500 years. Zionism is a 19th-century political movement founded at a congress in Basel in 1897. The documented record of Jewish theologians, rabbinical authorities, and organized Jewish communities treating these as distinct, and sometimes in direct opposition, spans more than a century. ClownBinge reviewed the primary sources.","Judaism ranks among the oldest spiritual traditions people still practice. Judaism's covenant, law, prayer, and ethical framework survived approximately 3,500 years: pharaohs, exile, two destroyed Temples, persecution on every continent, centuries when faith was the only thread holding Jewish communities together. By any historical measure, it ranks among humanity's most profound religious civilizations and most enduring. Zionism is a political movement. The organization was founded at a congress in Basel, Switzerland, on August 29, 1897. The First Zionist Congress happened 127 years ago. Judaism has been around for roughly 3,500 years. The comparison falls apart. The distinction between these two things, one among humanity's oldest sacred traditions, the other a modern political program, was not invented by critics of Israel. It was made by Jewish theologians before Zionism existed, and by rabbinical authorities who opposed the movement on explicitly theological grounds from the moment it was founded. ClownBinge reviewed the primary record. The Founding Document On February 14, 1896, Theodor Herzl published Der Judenstaat (The Jewish State) . It was not a religious text. It was a political pamphlet, subtitled ""Proposal of a Modern Solution for the Jewish Question."" Herzl was an Austro-Hungarian journalist and playwright, largely secular. His diary and letters reveal a man responding to Europe's political crisis of antisemitism, not to the Torah or rabbinical authority or any prophetic mandate. His original proposals included the Argentine pampas and British East Africa as potential locations for a Jewish homeland before Palestine was settled upon. The Basel Program adopted at the First Zionist Congress reads: ""Zionism seeks to establish a home for the Jewish people in Palestine secured under public law."" Treaties, international diplomacy, recognized legal frameworks: that's what ""secured under public law"" actually means. The document invokes no divine command. It cites no scripture. It has no rabbinical endorsement. It's a political platform, and you can tell. What Jewish Religious Leaders Said Before Zionism Existed Twelve years before Herzl convened the First Zionist Congress, the Central Conference of American Rabbis adopted the Pittsburgh Platform of 1885 . American Reform Judaism considers it one of its foundational documents. On the question of Jewish nationhood, it was unambiguous: We consider ourselves no longer a nation but a religious community, so we expect neither a return to Palestine, nor sacrificial worship under the sons of Aaron, nor the restoration of any laws concerning the Jewish state These weren't outsiders talking. They were the formally adopted principles of the Reform rabbinical conference, Jewish religious leaders speaking from within their own sacred tradition, twelve years before Zionism existed as an organized political movement. Their position was that Jewish identity is a spiritual and religious inheritance, not a national-political category. The Orthodox Rabbinical Record Opposition to Zionism from within Orthodox Judaism was not a marginal reaction. The Neturei Karta , an Orthodox Jewish sect founded in Jerusalem in 1938, a full decade before the establishment of the State of Israel, explicitly opposes Zionism on Talmudic grounds. Their theology comes from the rabbinical tradition that kept Judaism alive through centuries of diaspora: creating a Jewish state before the Messiah arrives breaks divine law as laid out in the Talmud's tractate Ketubot. This is not a political objection. It's a halakhic one, pulled from the same ancient textual tradition that predates Herzl by roughly fifteen centuries. Rabbi Yoel Teitelbaum laid out the most comprehensive modern statement of this theological opposition in his 1961 work Vayoel Moshe , speaking for the Satmar Hasidic dynasty, one of the largest Hasidic communities in the world, with hundreds of thousands of adherents. The text makes a textual and halakhic case that Zionism violates the Torah's ban on forcing the messianic era through political action. Satmar communities still use it today. Satmar community members live in the State of Israel even as they reject its religious legitimacy, a distinction they defend using the same ancient texts that define Judaism itself. The American Jewish Organizational Record Reform Jewish rabbis and lay leaders founded the American Council for Judaism in 1942 to explicitly oppose the Zionist platform. It peaked at approximately 15,000 members, pulled from established Reform congregations in major American cities. The group's founding stance declared Zionism incompatible with Judaism understood as a religious community, continuing a position their predecessors had adopted fifty-seven years earlier in the Pittsburgh Platform. Jewish Voice for Peace, a national Jewish American organization with chapters across the United States, draws an explicit line between Jewish identity and Zionism in its platform. Jewish Americans lead it and fill its ranks, drawing the same line Reform rabbis drew in 1885 and Orthodox rabbis drew in 1938: Judaism's sacred inheritance and Zionism's political program are separate things, and honoring one does not require embracing the other. The IHRA Definition and Its Own Author The International Holocaust Remembrance Alliance (IHRA) Working Definition of Antisemitism has been adopted by numerous governments and institutions. Some institutions took one of its flagged behaviors, ""denying the Jewish people their right to self-determination,"" and stretched it to include criticism of Israeli government policy. Kenneth Stern, the primary author of that definition, documented his concern about this application directly. Testifying before the U.S. House Judiciary Committee on November 7, 2017 , Stern stated that the definition he drafted was being misused as a tool to suppress political speech, and that this application was contrary to his intent. He later described it as a ""weaponization"" of the framework. The man who wrote the most widely-used institutional definition of antisemitism documented, in sworn congressional testimony, that it was being applied in ways that conflated criticism of Israeli policy with hatred of Jewish people, the precise conflation this record addresses. What's in the Record Judaism deserves to be understood on its own terms: a living, sacred tradition sustained across 35 centuries that produced a body of law, philosophy, literature, and spiritual practice shaping civilization itself. It belongs to no political movement. It predates the nation-state as a concept by more than three thousand years. Zionism, as its founders stated in their own documents, is a political program. Late 19th century political operatives invented it to solve one specific crisis they were facing. It began as a pamphlet, not a scroll. Its founders were journalists and lawyers, not prophets or rabbis. The record of Jewish voices, Reform rabbis in 1885, Orthodox Hasidim in 1938 and 1961, American Jewish organizations in 1942, Jewish-led organizations today, and the author of the IHRA definition itself, drawing this distinction is not marginal, not new, and not external to Judaism. It is part of the documented internal history of Jewish thought. To conflate the two does not honor Judaism. The primary sources say so. ClownBinge publishes the record.","CCAR: Pittsburgh Platform (1885) :: Central Conference of American Rabbis. (1885). The Pittsburgh Platform: Declaration of Principles. Central Conference of American Rabbis.; U.S. Congress: Anti-Semitism Awareness Act (2017) :: U.S. Congress. (2017). Anti-Semitism Awareness Act. Congressional Record, 114th Congress. U.S. Government Publishing Office.; Jewish Voice for Peace: Organizational Statements :: Jewish Voice for Peace. (2024). Official Organizational Position Statements. Jewish Voice for Peace, Oakland, California."
